<?xml version="1.0" encoding="UTF-8"?>
<!DOCTYPE interface SYSTEM "interface.dtd">
<interface name="PclDatabaseStoreInterface" author="Tim Niemueller" year="2012-2014">
  <data>
    <comment>
      Instruct the pcl-db-store plugin.
    </comment>
    <field type="uint32" name="msgid">
      The ID of the message that is currently being processed, or 0 if
      no message is being processed.
    </field>
    <field type="bool" name="final">
      True, if the last goto command has been finished, false if it is
      still running.
    </field>
    <field type="string" length="256" name="error">
      Error description if reconstruction fails.
    </field>
  </data>
  <message name="Store">
    <comment>Order storing a point cloud.</comment>
    <field type="string" length="64" name="pcl_id">
      ID of the point cloud to store.
    </field>
    <field type="string" length="64" name="database">
      Database name from which to read the point clouds. If empty will
      use plugin-configured default.
    </field>
    <field type="string" length="128" name="collection">
      Collection name from which to read the point clouds. May NOT
      include the database name.
    </field>
  </message>
</interface>
