<?xml version="1.0" encoding="UTF-8"?>
<!DOCTYPE interface SYSTEM "interface.dtd">
<interface name="LedInterface" author="Tim Niemueller" year="2008">
  <constants>
    <constant type="float" name="ON" value="1.0">Turn LED on.</constant>
    <constant type="float" name="OFF" value="0.0">Turn LED off.</constant>
  </constants>
  <data>
    <comment>
      This interface provides access to LEDs. The interface controls an
      intensity value between 0.0 (off) and 1.0 (on, max intensity). LEDs
      that do not support intensity setting can only be set to on and off.
    </comment>
    <field type="float" name="intensity">Intensity value.</field>
  </data>
  <message name="SetIntensity">
    <comment>Sets a new intensity on the LED.</comment>
    <ref>intensity</ref>
    <field type="float" name="time_sec">
      Time in seconds when to reach the intensity.
    </field>
  </message>
  <message name="TurnOn">
    <comment>Turns the LED on to maximum intensity immediately.</comment>
  </message>
  <message name="TurnOff">
    <comment>Turns the LED off immediately.</comment>
  </message>
</interface>
