<?xml version="1.0" encoding="UTF-8"?>
<!DOCTYPE interface SYSTEM "interface.dtd">
<interface name="GameStateInterface" author="Tim Niemueller" year="2008">
  <constants>
    <!-- MSL game states, more generic to soccer -->
    <constant type="uint32" value="0" name="GS_FROZEN">Frozen, nothing moves.</constant>
    <constant type="uint32" value="1" name="GS_PLAY">Play, normal play</constant>
    <constant type="uint32" value="2" name="GS_KICK_OFF">Kick off</constant>
    <constant type="uint32" value="3" name="GS_DROP_BALL">Referee drops ball, both teams can wrestle for the ball</constant>
    <constant type="uint32" value="4" name="GS_PENALTY">Penalty kick</constant>
    <constant type="uint32" value="5" name="GS_CORNER_KICK">Corner kick</constant>
    <constant type="uint32" value="6" name="GS_THROW_IN">Throw in</constant>
    <constant type="uint32" value="7" name="GS_FREE_KICK">Free kick</constant>
    <constant type="uint32" value="8" name="GS_GOAL_KICK">Goal kick</constant>
    <constant type="uint32" value="9" name="GS_HALF_TIME">Half time</constant>

    <!-- SPL game states, game process state machine -->
    <constant type="uint32" value="0" name="GS_SPL_INITIAL">Initial setup phase.</constant>
    <constant type="uint32" value="1" name="GS_SPL_READY">Move to kick-off positions.</constant>
    <constant type="uint32" value="2" name="GS_SPL_SET">Wait for kick-off.</constant>
    <constant type="uint32" value="3" name="GS_SPL_PLAY">Play!</constant>
    <constant type="uint32" value="4" name="GS_SPL_FINISHED">Game or Half-time is finished</constant>

    <enum name="if_gamestate_team_t">
      <comment>
        Enumeration defining the different teams. Keep in sync with
	worldinfo_gamestate_team_t.
      </comment>
      <item name="TEAM_NONE">No team, not team-specific</item>
      <item name="TEAM_CYAN">Cyan team</item>
      <item name="TEAM_MAGENTA">Magenta team</item>
      <item name="TEAM_BOTH">Both teams</item>
    </enum>
    <enum name="if_gamestate_goalcolor_t">
      <comment>
        Enumeration defining the different teams. Keep in sync with
	worldinfo_gamestate_goalcolor_t.
      </comment>
      <item name="GOAL_BLUE">Blue goal</item>
      <item name="GOAL_YELLOW">Yellow goal</item>
    </enum>
    <enum name="if_gamestate_half_t">
      <comment>
        Enumeration defining the different teams. Keep in sync with
	worldinfo_gamestate_half_t.
      </comment>
      <item name="HALF_FIRST">First half</item>
      <item name="HALF_SECOND">Second half</item>
    </enum>
    <enum name="if_gamestate_role_t">
      <comment>
        Enumeration defining the different robot roles. Keep in sync with
	worldinfo_gamestate_role_t.
      </comment>
      <item name="ROLE_GOALIE">Goalie</item>
      <item name="ROLE_DEFENDER">Defender</item>
      <item name="ROLE_MID_LEFT">Midfield left</item>
      <item name="ROLE_MID_RIGHT">Midfield right</item>
      <item name="ROLE_ATTACKER">Attacker</item>
    </enum>
  </constants>
  <data>
    <comment>
      This interface provides access to the current game state. It is closely related to
      the WorldInfo network protocol.
      @see WorldInfoTransceiver
    </comment>
    <field type="uint32" name="game_state">Current game state</field>
    <field type="if_gamestate_team_t" name="state_team">Team referred to by game state</field>
    <field type="if_gamestate_team_t" name="our_team">Our team color</field>
    <field type="if_gamestate_goalcolor_t" name="our_goal_color">Our own goal color</field>
    <field type="if_gamestate_half_t" name="half">Current game half</field>
    <field type="bool" name="kickoff">Whether we have kickoff</field>
    <field type="if_gamestate_role_t" name="role">Current role of this robot</field>
    <field type="uint32" name="score_cyan">Score of team cyan</field>
    <field type="uint32" name="score_magenta">Score of team magenta</field>
  </data>
  <message name="SetTeamColor">
    <comment>Set color of own team</comment>
    <ref>our_team</ref>
  </message>
  <message name="SetKickoff">
    <comment>Set whether we have kickoff</comment>
    <ref>kickoff</ref>
  </message>
  <message name="SetStateTeam">
    <comment>Set the team the playmode applies to.</comment>
    <ref>state_team</ref>
  </message>
</interface>
